Poster_Link,Series_Title,Released_Year,Certificate,Runtime,Genre,IMDB_Rating,Overview,Meta_score,Director,Star1,Star2,Star3,Star4,No_of_Votes,Gross
"https://m.media-amazon.com/images/M/MV5BOTY4NTU2NTU4NF5BMl5BanBnXkFtZTcwNjE0OTc5MQ@@._V1_UX67_CR0,0,67,98_AL_.jpg",Frost/Nixon,2008,R,122 min,"Biography, Drama, History",7.7,A dramatic retelling of the post-Watergate television interviews between British talk-show host David Frost and former president Richard Nixon.,80.0,Ron Howard,Frank Langella,Michael Sheen,Kevin Bacon,Sam Rockwell,103330,"18,593,156"
"https://m.media-amazon.com/images/M/MV5BNDliMTMxOWEtODM3Yi00N2QwLTg4YTAtNTE5YzBlNTA2NjhlXkEyXkFqcGdeQXVyNjE5MjUyOTM@._V1_UX67_CR0,0,67,98_AL_.jpg",Papurika,2006,U,90 min,"Animation, Drama, Fantasy",7.7,"When a machine that allows therapists to enter their patients' dreams is stolen, all Hell breaks loose. Only a young female therapist, Paprika, can stop it.",81.0,Satoshi Kon,Megumi Hayashibara,Tôru Emori,Katsunosuke Hori,Tôru Furuya,71379,"881,302"
"https://m.media-amazon.com/images/M/MV5BOTA1Mzg3NjIxNV5BMl5BanBnXkFtZTcwNzU2NTc5MQ@@._V1_UX67_CR0,0,67,98_AL_.jpg",Changeling,2008,R,141 min,"Biography, Crime, Drama",7.7,Grief-stricken mother Christine Collins (Angelina Jolie) takes on the L.A.P.D. to her own detriment when it tries to pass off an obvious impostor as her missing child.,63.0,Clint Eastwood,Angelina Jolie,Colm Feore,Amy Ryan,Gattlin Griffith,239203,"35,739,802"
"https://m.media-amazon.com/images/M/MV5BMTU2NjQ1Nzc4MF5BMl5BanBnXkFtZTcwNTM0NDk1Mw@@._V1_UX67_CR0,0,67,98_AL_.jpg",Flipped,2010,PG,90 min,"Comedy, Drama, Romance",7.7,Two eighth-graders start to have feelings for each other despite being total opposites.,45.0,Rob Reiner,Madeline Carroll,Callan McAuliffe,Rebecca De Mornay,Anthony Edwards,81446,"1,752,214"
"https://m.media-amazon.com/images/M/MV5BMzA4ZGM1NjYtMjcxYS00MTdiLWJmNzEtMTUzODY0NDQ0YzUzXkEyXkFqcGdeQXVyMzYwMjQ3OTI@._V1_UY98_CR1,0,67,98_AL_.jpg",Toki o kakeru shôjo,2006,U,98 min,"Animation, Adventure, Comedy",7.7,"A high-school girl named Makoto acquires the power to travel back in time, and decides to use it for her own personal benefits. Little does she know that she is affecting the lives of others just as much as she is her own.",,Mamoru Hosoda,Riisa Naka,Takuya Ishida,Mitsutaka Itakura,Ayami Kakiuchi,60368,
"https://m.media-amazon.com/images/M/MV5BZDNlNjEzMzQtZDM0MS00YzhiLTk0MGUtYTdmNDZiZGVjNTk0L2ltYWdlXkEyXkFqcGdeQXVyNTAyODkwOQ@@._V1_UY98_CR1,0,67,98_AL_.jpg",Death Note: Desu nôto,2006,,126 min,"Crime, Drama, Fantasy",7.7,"A battle between the world's two greatest minds begins when Light Yagami finds the Death Note, a notebook with the power to kill, and decides to rid the world of criminals.",,Shûsuke Kaneko,Tatsuya Fujiwara,Ken'ichi Matsuyama,Asaka Seto,Yû Kashii,28630,
"https://m.media-amazon.com/images/M/MV5BMmE3OWZhZDYtOTBjMi00NDIwLTg1NWMtMjg0NjJmZWM4MjliL2ltYWdlXkEyXkFqcGdeQXVyNTAyODkwOQ@@._V1_UX67_CR0,0,67,98_AL_.jpg",This Is England,2006,,101 min,"Crime, Drama",7.7,"A young boy becomes friends with a gang of skinheads. Friends soon become like family, and relationships will be pushed to the very limit.",86.0,Shane Meadows,Thomas Turgoose,Stephen Graham,Jo Hartley,Andrew Shim,115576,"327,919"
"https://m.media-amazon.com/images/M/MV5BMTUxNzc0OTIxMV5BMl5BanBnXkFtZTgwNDI3NzU2NDE@._V1_UX67_CR0,0,67,98_AL_.jpg",Ex Machina,2014,UA,108 min,"Drama, Sci-Fi, Thriller",7.7,A young programmer is selected to participate in a ground-breaking experiment in synthetic intelligence by evaluating the human qualities of a highly advanced humanoid A.I.,78.0,Alex Garland,Alicia Vikander,Domhnall Gleeson,Oscar Isaac,Sonoya Mizuno,474141,"25,442,958"
"https://m.media-amazon.com/images/M/MV5BMjIxODEyOTQ5Ml5BMl5BanBnXkFtZTcwNjE3NzI5Mw@@._V1_UY98_CR1,0,67,98_AL_.jpg",Efter brylluppet,2006,R,120 min,Drama,7.7,"A manager of an orphanage in India is sent to Copenhagen, Denmark, where he discovers a life-altering family secret.",78.0,Susanne Bier,Mads Mikkelsen,Sidse Babett Knudsen,Rolf Lassgård,Neeral Mulchandani,32001,"412,544"
"https://m.media-amazon.com/images/M/MV5BMjM1NTkxNjkzMl5BMl5BanBnXkFtZTgwNDgwMDAxMzE@._V1_UY98_CR1,0,67,98_AL_.jpg",The Last King of Scotland,2006,R,123 min,"Biography, Drama, History",7.7,Based on the events of the brutal Ugandan dictator Idi Amin's regime as seen by his personal physician during the 1970s.,74.0,Kevin Macdonald,James McAvoy,Forest Whitaker,Gillian Anderson,Kerry Washington,175355,"17,605,861"
"https://m.media-amazon.com/images/M/MV5BN2UwNDc5NmEtNjVjZS00OTI5LWE5YjctMWM3ZjBiZGYwMGI2XkEyXkFqcGdeQXVyNzkwMjQ5NzM@._V1_UX67_CR0,0,67,98_AL_.jpg",Zodiac,2007,UA,157 min,"Crime, Drama, Mystery",7.7,"In the late 1960s/early 1970s, a San Francisco cartoonist becomes an amateur detective obsessed with tracking down the Zodiac Killer, an unidentified individual who terrorizes Northern California with a killing spree.",78.0,David Fincher,Jake Gyllenhaal,Robert Downey Jr.,Mark Ruffalo,Anthony Edwards,466080,"33,080,084"
"https://m.media-amazon.com/images/M/MV5BZjczMWI1YWMtYTZjOS00ZDc5LWE2MWItMTY3ZGUxNzFkNjJmL2ltYWdlXkEyXkFqcGdeQXVyNjU0OTQ0OTY@._V1_UX67_CR0,0,67,98_AL_.jpg",Lucky Number Slevin,2006,R,110 min,"Action, Crime, Drama",7.7,"A case of mistaken identity lands Slevin into the middle of a war being plotted by two of the city's most rival crime bosses. Under constant surveillance by Detective Brikowski and assassin Goodkat, he must get them before they get him.",53.0,Paul McGuigan,Josh Hartnett,Ben Kingsley,Morgan Freeman,Lucy Liu,299524,"22,494,487"
"https://m.media-amazon.com/images/M/MV5BMTQyODczNjU3NF5BMl5BanBnXkFtZTcwNjQ0NDIzMQ@@._V1_UX67_CR0,0,67,98_AL_.jpg",Joyeux Noël,2005,PG-13,116 min,"Drama, History, Music",7.7,"In December 1914, an unofficial Christmas truce on the Western Front allows soldiers from opposing sides of the First World War to gain insight into each other's way of life.",70.0,Christian Carion,Diane Kruger,Benno Fürmann,Guillaume Canet,Natalie Dessay,28003,"1,054,361"
"https://m.media-amazon.com/images/M/MV5BNTEzOTYwMTcxN15BMl5BanBnXkFtZTcwNTgyNjI1MQ@@._V1_UX67_CR0,0,67,98_AL_.jpg",Control,2007,R,122 min,"Biography, Drama, Music",7.7,"A profile of Ian Curtis, the enigmatic singer of Joy Division whose personal, professional, and romantic troubles led him to commit suicide at the age of 23.",78.0,Anton Corbijn,Sam Riley,Samantha Morton,Craig Parkinson,Alexandra Maria Lara,61609,"871,577"
"https://m.media-amazon.com/images/M/MV5BMTAxNDYxMjg0MjNeQTJeQWpwZ15BbWU3MDcyNTk2OTM@._V1_UX67_CR0,0,67,98_AL_.jpg",Tangled,2010,U,100 min,"Animation, Adventure, Comedy",7.7,"The magically long-haired Rapunzel has spent her entire life in a tower, but now that a runaway thief has stumbled upon her, she is about to discover the world for the first time, and who she really is.",71.0,Nathan Greno,Byron Howard,Mandy Moore,Zachary Levi,Donna Murphy,405922,"200,821,936"
"https://m.media-amazon.com/images/M/MV5BODFlNTI0ZWQtOTcxNC00OTc0LTkwZDUtMmNkM2I1ZWFlYzZkXkEyXkFqcGdeQXVyNTIzOTk5ODM@._V1_UY98_CR2,0,67,98_AL_.jpg",Zwartboek,2006,R,145 min,"Drama, Thriller, War",7.7,"In the Nazi-occupied Netherlands during World War II, a Jewish singer infiltrates the regional Gestapo headquarters for the Dutch resistance.",71.0,Paul Verhoeven,Carice van Houten,Sebastian Koch,Thom Hoffman,Halina Reijn,72643,"4,398,392"
"https://m.media-amazon.com/images/M/MV5BMTY5NTAzNTc1NF5BMl5BanBnXkFtZTYwNDY4MDc3._V1_UX67_CR0,0,67,98_AL_.jpg",Brokeback Mountain,2005,A,134 min,"Drama, Romance",7.7,"The story of a forbidden and secretive relationship between two cowboys, and their lives over the years.",87.0,Ang Lee,Jake Gyllenhaal,Heath Ledger,Michelle Williams,Randy Quaid,323103,"83,043,761"
"https://m.media-amazon.com/images/M/MV5BODE0NTcxNTQzNF5BMl5BanBnXkFtZTcwMzczOTIzMw@@._V1_UX67_CR0,0,67,98_AL_.jpg",3:10 to Yuma,2007,A,122 min,"Action, Crime, Drama",7.7,A small-time rancher agrees to hold a captured outlaw who's awaiting a train to go to court in Yuma. A battle of wills ensues as the outlaw tries to psych out the rancher.,76.0,James Mangold,Russell Crowe,Christian Bale,Ben Foster,Logan Lerman,288797,"53,606,916"
"https://m.media-amazon.com/images/M/MV5BOTk1OTA1MjIyNV5BMl5BanBnXkFtZTcwODQxMTkyMQ@@._V1_UX67_CR0,0,67,98_AL_.jpg",Crash,2004,UA,112 min,"Crime, Drama, Thriller",7.7,"Los Angeles citizens with vastly separate lives collide in interweaving stories of race, loss and redemption.",66.0,Paul Haggis,Don Cheadle,Sandra Bullock,Thandie Newton,Karina Arroyave,419483,"54,580,300"
"https://m.media-amazon.com/images/M/MV5BMjZiOTNlMzYtZWYwZS00YWJjLTk5NDgtODkwNjRhMDI0MjhjXkEyXkFqcGdeQXVyMjgyNjk3MzE@._V1_UY98_CR1,0,67,98_AL_.jpg",Kung fu,2004,UA,99 min,"Action, Comedy, Fantasy",7.7,"In Shanghai, China in the 1940s, a wannabe gangster aspires to join the notorious ""Axe Gang"" while residents of a housing complex exhibit extraordinary powers in defending their turf.",78.0,Stephen Chow,Stephen Chow,Wah Yuen,Qiu Yuen,Siu-Lung Leung,127250,"17,108,591"
"https://m.media-amazon.com/images/M/MV5BYTIyMDFmMmItMWQzYy00MjBiLTg2M2UtM2JiNDRhOWE4NjBhXkEyXkFqcGdeQXVyNjU0OTQ0OTY@._V1_UX67_CR0,0,67,98_AL_.jpg",The Bourne Supremacy,2004,A,108 min,"Action, Mystery, Thriller",7.7,"When Jason Bourne is framed for a CIA operation gone awry, he is forced to resume his former life as a trained assassin to survive.",73.0,Paul Greengrass,Matt Damon,Franka Potente,Joan Allen,Brian Cox,434841,"176,241,941"
"https://m.media-amazon.com/images/M/MV5BNjk1NzBlY2YtNjJmNi00YTVmLWI2OTgtNDUxNDE5NjUzZmE0XkEyXkFqcGdeQXVyNTc1NTQxODI@._V1_UX67_CR0,0,67,98_AL_.jpg",The Machinist,2004,R,101 min,"Drama, Thriller",7.7,An industrial worker who hasn't slept in a year begins to doubt his own sanity.,61.0,Brad Anderson,Christian Bale,Jennifer Jason Leigh,Aitana Sánchez-Gijón,John Sharian,358432,"1,082,715"
"https://m.media-amazon.com/images/M/MV5BMTQxNDQwNjQzOV5BMl5BanBnXkFtZTcwNTQxNDYyMQ@@._V1_UX67_CR0,0,67,98_AL_.jpg",Ray,2004,A,152 min,"Biography, Drama, Music",7.7,"The story of the life and career of the legendary rhythm and blues musician Ray Charles, from his humble beginnings in the South, where he went blind at age seven, to his meteoric rise to stardom during the 1950s and 1960s.",73.0,Taylor Hackford,Jamie Foxx,Regina King,Kerry Washington,Clifton Powell,138356,"75,331,600"
"https://m.media-amazon.com/images/M/MV5BMTI2NDI5ODk4N15BMl5BanBnXkFtZTYwMTI3NTE3._V1_UX67_CR0,0,67,98_AL_.jpg",Lost in Translation,2003,UA,102 min,"Comedy, Drama",7.7,A faded movie star and a neglected young woman form an unlikely bond after crossing paths in Tokyo.,89.0,Sofia Coppola,Bill Murray,Scarlett Johansson,Giovanni Ribisi,Anna Faris,415074,"44,585,453"
"https://m.media-amazon.com/images/M/MV5BMTI1NDMyMjExOF5BMl5BanBnXkFtZTcwOTc4MjQzMQ@@._V1_UX67_CR0,0,67,98_AL_.jpg",Harry Potter and the Goblet of Fire,2005,UA,157 min,"Adventure, Family, Fantasy",7.7,"Harry Potter finds himself competing in a hazardous tournament between rival schools of magic, but he is distracted by recurring nightmares.",81.0,Mike Newell,Daniel Radcliffe,Emma Watson,Rupert Grint,Eric Sykes,548619,"290,013,036"
"https://m.media-amazon.com/images/M/MV5BODFlMmEwMDgtYjhmZi00ZTE5LTk2NWQtMWE1Y2M0NjkzOGYxXkEyXkFqcGdeQXVyNjU0OTQ0OTY@._V1_UX67_CR0,0,67,98_AL_.jpg",Man on Fire,2004,UA,146 min,"Action, Crime, Drama",7.7,"In Mexico City, a former CIA operative swears vengeance on those who committed an unspeakable act against the family he was hired to protect.",47.0,Tony Scott,Denzel Washington,Christopher Walken,Dakota Fanning,Radha Mitchell,329592,"77,911,774"
"https://m.media-amazon.com/images/M/MV5BMzQxNjM5NzkxNV5BMl5BanBnXkFtZTcwMzg5NDMwMg@@._V1_UX67_CR0,0,67,98_AL_.jpg",Coraline,2009,U,100 min,"Animation, Drama, Family",7.7,"An adventurous 11-year-old girl finds another world that is a strangely idealized version of her frustrating home, but it has sinister secrets.",80.0,Henry Selick,Dakota Fanning,Teri Hatcher,John Hodgman,Jennifer Saunders,197761,"75,286,229"
"https://m.media-amazon.com/images/M/MV5BMzkyNzQ1Mzc0NV5BMl5BanBnXkFtZTcwODg3MzUzMw@@._V1_UX67_CR0,0,67,98_AL_.jpg",The Last Samurai,2003,UA,154 min,"Action, Drama",7.7,An American military advisor embraces the Samurai culture he was hired to destroy after he is captured in battle.,55.0,Edward Zwick,Tom Cruise,Ken Watanabe,Billy Connolly,William Atherton,400049,"111,110,575"
"https://m.media-amazon.com/images/M/MV5BMTI2NzU1NTc1NF5BMl5BanBnXkFtZTcwOTQ1MjAwMQ@@._V1_UX67_CR0,0,67,98_AL_.jpg",The Magdalene Sisters,2002,R,114 min,Drama,7.7,Three young Irish women struggle to maintain their spirits while they endure dehumanizing abuse as inmates of a Magdalene Sisters Asylum.,83.0,Peter Mullan,Eileen Walsh,Dorothy Duffy,Nora-Jane Noone,Anne-Marie Duff,25938,"4,890,878"
"https://m.media-amazon.com/images/M/MV5BMTI0MTg4NzI3M15BMl5BanBnXkFtZTcwOTE0MTUyMQ@@._V1_UY98_CR0,0,67,98_AL_.jpg",Good Bye Lenin!,2003,R,121 min,"Comedy, Drama, Romance",7.7,"In 1990, to protect his fragile mother from a fatal shock after a long coma, a young man must keep her from learning that her beloved nation of East Germany as she knew it has disappeared.",68.0,Wolfgang Becker,Daniel Brühl,Katrin Saß,Chulpan Khamatova,Florian Lukas,137981,"4,064,200"
"https://m.media-amazon.com/images/M/MV5BOGY1YmUzN2MtNDQ3NC00Nzc4LWI5M2EtYzUwMGQ4NWM4NjE1XkEyXkFqcGdeQXVyMTQxNzMzNDI@._V1_UY98_CR0,0,67,98_AL_.jpg",In America,2002,PG-13,105 min,Drama,7.7,A family of Irish immigrants adjust to life on the mean streets of Hell's Kitchen while also grieving the death of a child.,76.0,Jim Sheridan,Paddy Considine,Samantha Morton,Djimon Hounsou,Sarah Bolger,40403,"15,539,266"
"https://m.media-amazon.com/images/M/MV5BYzEyNzc0NjctZjJiZC00MWI1LWJlOTMtYWZkZDAzNzQ0ZDNkXkEyXkFqcGdeQXVyMTQxNzMzNDI@._V1_UX67_CR0,0,67,98_AL_.jpg",I Am Sam,2001,PG-13,132 min,Drama,7.7,A mentally handicapped man fights for custody of his 7-year-old daughter and in the process teaches his cold-hearted lawyer the value of love and family.,28.0,Jessie Nelson,Sean Penn,Michelle Pfeiffer,Dakota Fanning,Dianne Wiest,142863,"40,311,852"
"https://m.media-amazon.com/images/M/MV5BZjIwZWU0ZDItNzBlNS00MDIwLWFlZjctZTJjODdjZWYxNzczL2ltYWdlXkEyXkFqcGdeQXVyMTMxODk2OTU@._V1_UX67_CR0,0,67,98_AL_.jpg",Adaptation.,2002,R,115 min,"Comedy, Drama",7.7,A lovelorn screenwriter becomes desperate as he tries and fails to adapt 'The Orchid Thief' by Susan Orlean for the screen.,83.0,Spike Jonze,Nicolas Cage,Meryl Streep,Chris Cooper,Tilda Swinton,178565,"22,245,861"
"https://m.media-amazon.com/images/M/MV5BYWMwMzQxZjQtODM1YS00YmFiLTk1YjQtNzNiYWY1MDE4NTdiXkEyXkFqcGdeQXVyNDYyMDk5MTU@._V1_UX67_CR0,0,67,98_AL_.jpg",Black Hawk Down,2001,A,144 min,"Drama, History, War",7.7,160 elite U.S. soldiers drop into Somalia to capture two top lieutenants of a renegade warlord and find themselves in a desperate battle with a large force of heavily-armed Somalis.,74.0,Ridley Scott,Josh Hartnett,Ewan McGregor,Tom Sizemore,Eric Bana,364254,"108,638,745"
"https://m.media-amazon.com/images/M/MV5BNjcxMmQ0MmItYTkzYy00MmUyLTlhOTQtMmJmNjE3MDMwYjdlXkEyXkFqcGdeQXVyNzkwMjQ5NzM@._V1_UX67_CR0,0,67,98_AL_.jpg",Road to Perdition,2002,A,117 min,"Crime, Drama, Thriller",7.7,"A mob enforcer's son witnesses a murder, forcing him and his father to take to the road, and his father down a path of redemption and revenge.",72.0,Sam Mendes,Tom Hanks,Tyler Hoechlin,Rob Maxey,Liam Aiken,246840,"104,454,762"
"https://m.media-amazon.com/images/M/MV5BNThiMDc1YjUtYmE3Zi00MTM1LTkzM2MtNjdlNzQ4ZDlmYjRmXkEyXkFqcGdeQXVyMTQxNzMzNDI@._V1_UY98_CR1,0,67,98_AL_.jpg",Das Experiment,2001,R,120 min,"Drama, Thriller",7.7,"For two weeks, 20 male participants are hired to play prisoners and guards in a prison. The ""prisoners"" have to follow seemingly mild rules, and the ""guards"" are told to retain order without using physical violence.",60.0,Oliver Hirschbiegel,Moritz Bleibtreu,Christian Berkel,Oliver Stokowski,Wotan Wilke Möhring,90842,"141,072"
"https://m.media-amazon.com/images/M/MV5BNGY3NWYwNzctNWU5Yi00ZjljLTgyNDgtZjNhZjRlNjc0ZTU1XkEyXkFqcGdeQXVyMTQxNzMzNDI@._V1_UX67_CR0,0,67,98_AL_.jpg",Billy Elliot,2000,R,110 min,"Drama, Music",7.7,A talented young boy becomes torn between his unexpected love of dance and the disintegration of his family.,74.0,Stephen Daldry,Jamie Bell,Julie Walters,Jean Heywood,Jamie Draven,126770,"21,995,263"
"https://m.media-amazon.com/images/M/MV5BZGY5NWUyNDUtZWJhZi00ZjMxLWFmMjMtYmJhZjVkZGZhNWQ4XkEyXkFqcGdeQXVyMTQxNzMzNDI@._V1_UX67_CR0,0,67,98_AL_.jpg",Hedwig and the Angry Inch,2001,R,95 min,"Comedy, Drama, Music",7.7,A gender-queer punk-rock singer from East Berlin tours the U.S. with her band as she tells her life story and follows the former lover/band-mate who stole her songs.,85.0,John Cameron Mitchell,John Cameron Mitchell,Miriam Shor,Stephen Trask,Theodore Liscinski,31957,"3,029,081"
"https://m.media-amazon.com/images/M/MV5BYzVmYzVkMmUtOGRhMi00MTNmLThlMmUtZTljYjlkMjNkMjJkXkEyXkFqcGdeQXVyNDk3NzU2MTQ@._V1_UX67_CR0,0,67,98_AL_.jpg",Ocean's Eleven,2001,UA,116 min,"Crime, Thriller",7.7,Danny Ocean and his ten accomplices plan to rob three Las Vegas casinos simultaneously.,74.0,Steven Soderbergh,George Clooney,Brad Pitt,Julia Roberts,Matt Damon,516372,"183,417,150"
"https://m.media-amazon.com/images/M/MV5BNTIyNThlMjMtMzUyMi00YmEyLTljMmYtMWRhN2Q3ZTllZjA4XkEyXkFqcGdeQXVyMzM4MjM0Nzg@._V1_UY98_CR1,0,67,98_AL_.jpg",Vampire Hunter D: Bloodlust,2000,U,103 min,"Animation, Action, Fantasy",7.7,"When a girl is abducted by a vampire, a legendary bounty hunter is hired to bring her back.",62.0,Yoshiaki Kawajiri,Andrew Philpot,John Rafter Lee,Pamela Adlon,Wendee Lee,29210,"151,086"
"https://m.media-amazon.com/images/M/MV5BMjZkOTdmMWItOTkyNy00MDdjLTlhNTQtYzU3MzdhZjA0ZDEyXkEyXkFqcGdeQXVyMTMxODk2OTU@._V1_UX67_CR0,0,67,98_AL_.jpg","O Brother, Where Art Thou?",2000,U,107 min,"Adventure, Comedy, Crime",7.7,"In the deep south during the 1930s, three escaped convicts search for hidden treasure while a relentless lawman pursues them.",69.0,Joel Coen,Ethan Coen,George Clooney,John Turturro,Tim Blake Nelson,286742,"45,512,588"
"https://m.media-amazon.com/images/M/MV5BZDYwYzlhOTAtNDAwMC00ZTBhLWI4M2QtMTA1NmJhYTdiNTkxXkEyXkFqcGdeQXVyNTM0NTU5Mg@@._V1_UX67_CR0,0,67,98_AL_.jpg",Interstate 60: Episodes of the Road,2002,R,116 min,"Adventure, Comedy, Drama",7.7,"Neal Oliver, a very confused young man and an artist, takes a journey of a lifetime on a highway I60 that doesn't exist on any of the maps, going to the places he never even heard of, searching for an answer and his dreamgirl.",,Bob Gale,James Marsden,Gary Oldman,Kurt Russell,Matthew Edison,29999,
"https://m.media-amazon.com/images/M/MV5BOGE0ZWI0YzAtY2NkZi00YjkyLWIzYWEtNTJmMzJjODllNjdjXkEyXkFqcGdeQXVyMTQxNzMzNDI@._V1_UX67_CR0,0,67,98_AL_.jpg","South Park: Bigger, Longer & Uncut",1999,A,81 min,"Animation, Comedy, Fantasy",7.7,"When Stan Marsh and his friends go see an R-rated movie, they start cursing and their parents think that Canada is to blame.",73.0,Trey Parker,Trey Parker,Matt Stone,Mary Kay Bergman,Isaac Hayes,192112,"52,037,603"
