Poster_Link,Series_Title,Released_Year,Certificate,Runtime,Genre,IMDB_Rating,Overview,Meta_score,Director,Star1,Star2,Star3,Star4,No_of_Votes,Gross
"https://m.media-amazon.com/images/M/MV5BMTQyNTAzOTI3NF5BMl5BanBnXkFtZTcwNTM0Mjg0Mg@@._V1_UX67_CR0,0,67,98_AL_.jpg",Wait Until Dark,1967,,108 min,Thriller,7.8,A recently blinded woman is terrorized by a trio of thugs while they search for a heroin-stuffed doll they believe is in her apartment.,81.0,Terence Young,Audrey Hepburn,Alan Arkin,Richard Crenna,Efrem Zimbalist Jr.,27733,"17,550,741"
"https://m.media-amazon.com/images/M/MV5BZTVmMTk2NjUtNjVjNC00OTcwLWE4OWEtNzA4Mjk1ZmIwNDExXkEyXkFqcGdeQXVyNjUwNzk3NDc@._V1_UX67_CR0,0,67,98_AL_.jpg",Guess Who's Coming to Dinner,1967,,108 min,"Comedy, Drama",7.8,A couple's attitudes are challenged when their daughter introduces them to her African-American fiancé.,63.0,Stanley Kramer,Spencer Tracy,Sidney Poitier,Katharine Hepburn,Katharine Houghton,39642,"56,700,000"
"https://m.media-amazon.com/images/M/MV5BOTViZmMwOGEtYzc4Yy00ZGQ1LWFkZDQtMDljNGZlMjAxMjhiXkEyXkFqcGdeQXVyNzM0MTUwNTY@._V1_UX67_CR0,0,67,98_AL_.jpg",Bonnie and Clyde,1967,A,111 min,"Action, Biography, Crime",7.8,"Bored waitress Bonnie Parker falls in love with an ex-con named Clyde Barrow and together they start a violent crime spree through the country, stealing cars and robbing banks.",86.0,Arthur Penn,Warren Beatty,Faye Dunaway,Michael J. Pollard,Gene Hackman,102415,
"https://m.media-amazon.com/images/M/MV5BNGM0ZTU3NmItZmRmMy00YWNjLWEzMWItYzg3MzcwZmM5NjdiXkEyXkFqcGdeQXVyNDYyMDk5MTU@._V1_UY98_CR2,0,67,98_AL_.jpg",My Fair Lady,1964,U,170 min,"Drama, Family, Musical",7.8,Snobbish phonetics Professor Henry Higgins agrees to a wager that he can make flower girl Eliza Doolittle presentable in high society.,95.0,George Cukor,Audrey Hepburn,Rex Harrison,Stanley Holloway,Wilfrid Hyde-White,86525,"72,000,000"
"https://m.media-amazon.com/images/M/MV5BNmJkODczNjItNDI5Yy00MGI1LTkyOWItZDNmNjM4ZGI1ZDVlL2ltYWdlL2ltYWdlXkEyXkFqcGdeQXVyMDI2NDg0NQ@@._V1_UX67_CR0,0,67,98_AL_.jpg",Mary Poppins,1964,U,139 min,"Comedy, Family, Fantasy",7.8,"In turn of the century London, a magical nanny employs music and adventure to help two neglected children become closer to their father.",88.0,Robert Stevenson,Julie Andrews,Dick Van Dyke,David Tomlinson,Glynis Johns,158029,"102,272,727"
"https://m.media-amazon.com/images/M/MV5BZTM1ZjQ2YTktNDM2MS00NGY2LTkzNzItZTU4ODg1ODNkMWYxL2ltYWdlXkEyXkFqcGdeQXVyNjc1NTYyMjg@._V1_UX67_CR0,0,67,98_AL_.jpg",The Longest Day,1962,G,178 min,"Action, Drama, History",7.8,"The events of D-Day, told on a grand scale from both the Allied and German points of view.",75.0,Ken Annakin,Andrew Marton,Gerd Oswald,Bernhard Wicki,Darryl F. Zanuck,52141,"39,100,000"
"https://m.media-amazon.com/images/M/MV5BZTM1MTRiNDctMTFiMC00NGM1LTkyMWQtNTY1M2JjZDczOWQ3XkEyXkFqcGdeQXVyMDI3OTIzOA@@._V1_UY98_CR3,0,67,98_AL_.jpg",Jules et Jim,1962,,105 min,"Drama, Romance",7.8,Decades of a love triangle concerning two friends and an impulsive woman.,97.0,François Truffaut,Jeanne Moreau,Oskar Werner,Henri Serre,Vanna Urbino,37605,
"https://m.media-amazon.com/images/M/MV5BNGQyNjBjNTUtNTM1OS00YzcyLWFhNTgtNTU0MDg3NzBlMDQzXkEyXkFqcGdeQXVyNjc1NTYyMjg@._V1_UY98_CR0,0,67,98_AL_.jpg",The Innocents,1961,A,100 min,Horror,7.8,A young governess for two children becomes convinced that the house and grounds are haunted.,88.0,Jack Clayton,Deborah Kerr,Peter Wyngarde,Megs Jenkins,Michael Redgrave,27007,"2,616,000"
"https://m.media-amazon.com/images/M/MV5BNzk5MDk2MjktY2I3NS00ODZkLTk3OTktY2Q3ZDE2MmQ2M2ZmXkEyXkFqcGdeQXVyNjc1NTYyMjg@._V1_UY98_CR2,0,67,98_AL_.jpg",À bout de souffle,1960,U,90 min,"Crime, Drama",7.8,"A small-time thief steals a car and impulsively murders a motorcycle policeman. Wanted by the authorities, he reunites with a hip American journalism student and attempts to persuade her to run away with him to Italy.",,Jean-Luc Godard,Jean-Paul Belmondo,Jean Seberg,Daniel Boulanger,Henri-Jacques Huet,73251,"336,705"
"https://m.media-amazon.com/images/M/MV5BNzNiOGJhMDUtZjNjMC00YmE5LTk3NjQtNGM4ZjAzOGJjZmRlXkEyXkFqcGdeQXVyNjc1NTYyMjg@._V1_UX67_CR0,0,67,98_AL_.jpg",Red River,1948,Passed,133 min,"Action, Adventure, Drama",7.8,"Dunson leads a cattle drive, the culmination of over 14 years of work, to its destination in Missouri. But his tyrannical behavior along the way causes a mutiny, led by his adopted son.",,Howard Hawks,Arthur Rosson,John Wayne,Montgomery Clift,Joanne Dru,28167,
"https://m.media-amazon.com/images/M/MV5BODI3YzNiZTUtYjEyZS00ODkwLWE2ZDUtNGJmMTNiYTc4ZTM4XkEyXkFqcGdeQXVyMDI2NDg0NQ@@._V1_UX67_CR0,0,67,98_AL_.jpg",Key Largo,1948,,100 min,"Action, Crime, Drama",7.8,"A man visits his war buddy's family hotel and finds a gangster running things. As a hurricane approaches, the two end up confronting each other.",,John Huston,Humphrey Bogart,Edward G. Robinson,Lauren Bacall,Lionel Barrymore,36995,
"https://m.media-amazon.com/images/M/MV5BZGU2YmU0MWMtMzg5My00ZmY2LTljMDItMTg2YTI5Y2U2OTE3XkEyXkFqcGdeQXVyMjUxODE0MDY@._V1_UY98_CR0,0,67,98_AL_.jpg",To Have and Have Not,1944,PG,100 min,"Adventure, Comedy, Film-Noir",7.8,"During World War II, American expatriate Harry Morgan helps transport a French Resistance leader and his beautiful wife to Martinique while romancing a sensuous lounge singer.",,Howard Hawks,Humphrey Bogart,Lauren Bacall,Walter Brennan,Dolores Moran,31053,
"https://m.media-amazon.com/images/M/MV5BM2I1YWM4NTYtYjA0Ny00ZDEwLTg3NTgtNzBjMzZhZTk1YTA1XkEyXkFqcGdeQXVyMTY5Nzc4MDY@._V1_UX67_CR0,0,67,98_AL_.jpg",Shadow of a Doubt,1943,PG,108 min,"Film-Noir, Thriller",7.8,"A young girl, overjoyed when her favorite uncle comes to visit the family, slowly begins to suspect that he is in fact the ""Merry Widow"" killer sought by the authorities.",94.0,Alfred Hitchcock,Teresa Wright,Joseph Cotten,Macdonald Carey,Henry Travers,59556,
"https://m.media-amazon.com/images/M/MV5BOGQ4NDUyNWQtZTEyOC00OTMzLWFhYjAtNDNmYmQ2MWQyMTRmXkEyXkFqcGdeQXVyNTA4NzY1MzY@._V1_UX67_CR0,0,67,98_AL_.jpg",Stagecoach,1939,Passed,96 min,"Adventure, Drama, Western",7.8,A group of people traveling on a stagecoach find their journey complicated by the threat of Geronimo and learn something about each other in the process.,93.0,John Ford,John Wayne,Claire Trevor,Andy Devine,John Carradine,43621,
"https://m.media-amazon.com/images/M/MV5BNjk3YzFjYTktOGY0ZS00Y2EwLTk2NTctYTI1Nzc2OWNiN2I4XkEyXkFqcGdeQXVyNzM0MTUwNTY@._V1_UX67_CR0,0,67,98_AL_.jpg",The Lady Vanishes,1938,,96 min,"Mystery, Thriller",7.8,"While travelling in continental Europe, a rich young playgirl realizes that an elderly lady seems to have disappeared from the train.",98.0,Alfred Hitchcock,Margaret Lockwood,Michael Redgrave,Paul Lukas,May Whitty,47400,
"https://m.media-amazon.com/images/M/MV5BMmVkOTRiYmItZjE4NS00MWNjLWE0ZmMtYzg5YzFjMjMyY2RkXkEyXkFqcGdeQXVyNjc1NTYyMjg@._V1_UX67_CR0,0,67,98_AL_.jpg",Bringing Up Baby,1938,Passed,102 min,"Comedy, Family, Romance",7.8,"While trying to secure a $1 million donation for his museum, a befuddled paleontologist is pursued by a flighty and often irritating heiress and her pet leopard, Baby.",91.0,Howard Hawks,Katharine Hepburn,Cary Grant,Charles Ruggles,Walter Catlett,55163,
"https://m.media-amazon.com/images/M/MV5BOTUzMzAzMzEzNV5BMl5BanBnXkFtZTgwOTg1NTAwMjE@._V1_UX67_CR0,0,67,98_AL_.jpg",Bride of Frankenstein,1935,,75 min,"Drama, Horror, Sci-Fi",7.8,"Mary Shelley reveals the main characters of her novel survived: Dr. Frankenstein, goaded by an even madder scientist, builds his monster a mate.",95.0,James Whale,Boris Karloff,Elsa Lanchester,Colin Clive,Valerie Hobson,43542,"4,360,000"
"https://m.media-amazon.com/images/M/MV5BYmYxZGU2NWYtNzQxZS00NmEyLWIzN2YtMDk5MWM0ODc5ZTE4XkEyXkFqcGdeQXVyNTA4NzY1MzY@._V1_UX67_CR0,0,67,98_AL_.jpg",Duck Soup,1933,,69 min,"Comedy, Musical, War",7.8,Rufus T. Firefly is named president/dictator of bankrupt Freedonia and declares war on neighboring Sylvania over the love of wealthy Mrs. Teasdale.,93.0,Leo McCarey,Groucho Marx,Harpo Marx,Chico Marx,Zeppo Marx,55581,
"https://m.media-amazon.com/images/M/MV5BYmMxZTU2ZDUtM2Y1MS00ZWFmLWJlN2UtNzI0OTJiOTYzMTk3XkEyXkFqcGdeQXVyMjUxODE0MDY@._V1_UX67_CR0,0,67,98_AL_.jpg",Scarface: The Shame of the Nation,1932,PG,93 min,"Action, Crime, Drama",7.8,"An ambitious and nearly insane violent gangster climbs the ladder of success in the mob, but his weaknesses prove to be his downfall.",87.0,Howard Hawks,Richard Rosson,Paul Muni,Ann Dvorak,Karen Morley,25312,
"https://m.media-amazon.com/images/M/MV5BMTQ0Njc1MjM0OF5BMl5BanBnXkFtZTgwNTY2NTUyMjE@._V1_UX67_CR0,0,67,98_AL_.jpg",Frankenstein,1931,Passed,70 min,"Drama, Horror, Sci-Fi",7.8,Dr. Frankenstein dares to tamper with life and death by creating a human monster out of lifeless body parts.,91.0,James Whale,Colin Clive,Mae Clarke,Boris Karloff,John Boles,65341,
"https://m.media-amazon.com/images/M/MV5BMTU0OTc3ODk4Ml5BMl5BanBnXkFtZTgwMzM4NzI5NjM@._V1_UX67_CR0,0,67,98_AL_.jpg",Roma,2018,R,135 min,Drama,7.7,A year in the life of a middle-class family's maid in Mexico City in the early 1970s.,96.0,Alfonso Cuarón,Yalitza Aparicio,Marina de Tavira,Diego Cortina Autrey,Carlos Peralta,140375,
"https://m.media-amazon.com/images/M/MV5BNjRhYzk2NDAtYzA1Mi00MmNmLWE1ZjQtMDBhZmUyMTdjZjBiXkEyXkFqcGdeQXVyNjk1Njg5NTA@._V1_UX67_CR0,0,67,98_AL_.jpg",God's Own Country,2017,,104 min,"Drama, Romance",7.7,"Spring. Yorkshire. Young farmer Johnny Saxby numbs his daily frustrations with binge drinking and casual sex, until the arrival of a Romanian migrant worker for lambing season ignites an intense relationship that sets Johnny on a new path.",85.0,Francis Lee,Josh O'Connor,Alec Secareanu,Gemma Jones,Ian Hart,25198,"335,609"
"https://m.media-amazon.com/images/M/MV5BNjk1Njk3YjctMmMyYS00Y2I4LThhMzktN2U0MTMyZTFlYWQ5XkEyXkFqcGdeQXVyODM2ODEzMDA@._V1_UY98_CR15,0,67,98_AL_.jpg",Deadpool 2,2018,R,119 min,"Action, Adventure, Comedy",7.7,"Foul-mouthed mutant mercenary Wade Wilson (a.k.a. Deadpool), brings together a team of fellow mutant rogues to protect a young boy with supernatural abilities from the brutal, time-traveling cyborg Cable.",66.0,David Leitch,Ryan Reynolds,Josh Brolin,Morena Baccarin,Julian Dennison,478586,"324,591,735"
"https://m.media-amazon.com/images/M/MV5BMTUyMjU1OTUwM15BMl5BanBnXkFtZTgwMDg1NDQ2MjI@._V1_UX67_CR0,0,67,98_AL_.jpg",Wind River,2017,R,107 min,"Crime, Drama, Mystery",7.7,A veteran hunter helps an FBI agent investigate the murder of a young woman on a Wyoming Native American reservation.,73.0,Taylor Sheridan,Kelsey Asbille,Jeremy Renner,Julia Jones,Teo Briones,205444,"33,800,859"
"https://m.media-amazon.com/images/M/MV5BMjUxMDQwNjcyNl5BMl5BanBnXkFtZTgwNzcwMzc0MTI@._V1_UX67_CR0,0,67,98_AL_.jpg",Get Out,2017,R,104 min,"Horror, Mystery, Thriller",7.7,"A young African-American visits his white girlfriend's parents for the weekend, where his simmering uneasiness about their reception of him eventually reaches a boiling point.",85.0,Jordan Peele,Daniel Kaluuya,Allison Williams,Bradley Whitford,Catherine Keener,492851,"176,040,665"
"https://m.media-amazon.com/images/M/MV5BNjRlZmM0ODktY2RjNS00ZDdjLWJhZGYtNDljNWZkMGM5MTg0XkEyXkFqcGdeQXVyNjAwMjI5MDk@._V1_UX67_CR0,0,67,98_AL_.jpg",Mission: Impossible - Fallout,2018,UA,147 min,"Action, Adventure, Thriller",7.7,"Ethan Hunt and his IMF team, along with some familiar allies, race against time after a mission gone wrong.",86.0,Christopher McQuarrie,Tom Cruise,Henry Cavill,Ving Rhames,Simon Pegg,291257,"220,159,104"
"https://m.media-amazon.com/images/M/MV5BMjE0NDUyOTc2MV5BMl5BanBnXkFtZTgwODk2NzU3OTE@._V1_UX67_CR0,0,67,98_AL_.jpg",En man som heter Ove,2015,PG-13,116 min,"Comedy, Drama, Romance",7.7,"Ove, an ill-tempered, isolated retiree who spends his days enforcing block association rules and visiting his wife's grave, has finally given up on life just as an unlikely friendship develops with his boisterous new neighbors.",70.0,Hannes Holm,Rolf Lassgård,Bahar Pars,Filip Berg,Ida Engvoll,47444,"3,358,518"
"https://m.media-amazon.com/images/M/MV5BMjAwNDA5NzEwM15BMl5BanBnXkFtZTgwMTA1MDUyNDE@._V1_UX67_CR0,0,67,98_AL_.jpg",What We Do in the Shadows,2014,R,86 min,"Comedy, Horror",7.7,"Viago, Deacon and Vladislav are vampires who are finding that modern life has them struggling with the mundane - like paying rent, keeping up with the chore wheel, trying to get into nightclubs and overcoming flatmate conflicts.",76.0,Jemaine Clement,Taika Waititi,Jemaine Clement,Taika Waititi,Cori Gonzalez-Macuer,157498,"3,333,000"
"https://m.media-amazon.com/images/M/MV5BZTlmYTJmMWEtNDRhNy00ODc1LTg2OTMtMjk2ODJhNTA4YTE1XkEyXkFqcGdeQXVyMTMxODk2OTU@._V1_UY98_CR0,0,67,98_AL_.jpg",Omoide no Mânî,2014,U,103 min,"Animation, Drama, Family",7.7,"Due to 12 y.o. Anna's asthma, she's sent to stay with relatives of her guardian in the Japanese countryside. She likes to be alone, sketching. She befriends Marnie. Who is the mysterious, blonde Marnie.",72.0,James Simone,Hiromasa Yonebayashi,Sara Takatsuki,Kasumi Arimura,Nanako Matsushima,32798,"765,127"
"https://m.media-amazon.com/images/M/MV5BMTAwMTU4MDA3NDNeQTJeQWpwZ15BbWU4MDk4NTMxNTIx._V1_UX67_CR0,0,67,98_AL_.jpg",The Theory of Everything,2014,U,123 min,"Biography, Drama, Romance",7.7,A look at the relationship between the famous physicist Stephen Hawking and his wife.,72.0,James Marsh,Eddie Redmayne,Felicity Jones,Tom Prior,Sophie Perry,404182,"35,893,537"
"https://m.media-amazon.com/images/M/MV5BYTM3ZTllNzItNTNmOS00NzJiLTg1MWMtMjMxNDc0NmJhODU5XkEyXkFqcGdeQXVyODE5NzE3OTE@._V1_UX67_CR0,0,67,98_AL_.jpg",Kingsman: The Secret Service,2014,A,129 min,"Action, Adventure, Comedy",7.7,"A spy organisation recruits a promising street kid into the agency's training program, while a global threat emerges from a twisted tech genius.",60.0,Matthew Vaughn,Colin Firth,Taron Egerton,Samuel L. Jackson,Michael Caine,590440,"128,261,724"
"https://m.media-amazon.com/images/M/MV5BNTVkMTFiZWItOTFkOC00YTc3LWFhYzQtZTg3NzAxZjJlNTAyXkEyXkFqcGdeQXVyODE5NzE3OTE@._V1_UX67_CR0,0,67,98_AL_.jpg",The Fault in Our Stars,2014,UA,126 min,"Drama, Romance",7.7,Two teenage cancer patients begin a life-affirming journey to visit a reclusive author in Amsterdam.,69.0,Josh Boone,Shailene Woodley,Ansel Elgort,Nat Wolff,Laura Dern,344312,"124,872,350"
"https://m.media-amazon.com/images/M/MV5BNTA1NzUzNjY4MV5BMl5BanBnXkFtZTgwNDU0MDI0NTE@._V1_UX67_CR0,0,67,98_AL_.jpg",Me and Earl and the Dying Girl,2015,PG-13,105 min,"Comedy, Drama",7.7,"High schooler Greg, who spends most of his time making parodies of classic movies with his co-worker Earl, finds his outlook forever altered after befriending a classmate who has just been diagnosed with cancer.",74.0,Alfonso Gomez-Rejon,Thomas Mann,RJ Cyler,Olivia Cooke,Nick Offerman,123210,"6,743,776"
"https://m.media-amazon.com/images/M/MV5BODAzNDMxMzAxOV5BMl5BanBnXkFtZTgwMDMxMjA4MjE@._V1_UX67_CR0,0,67,98_AL_.jpg",Birdman or (The Unexpected Virtue of Ignorance),2014,A,119 min,"Comedy, Drama",7.7,"A washed-up superhero actor attempts to revive his fading career by writing, directing, and starring in a Broadway production.",87.0,Alejandro G. Iñárritu,Michael Keaton,Zach Galifianakis,Edward Norton,Andrea Riseborough,580291,"42,340,598"
"https://m.media-amazon.com/images/M/MV5BMTQ5NTg5ODk4OV5BMl5BanBnXkFtZTgwODc4MTMzMDE@._V1_UX67_CR0,0,67,98_AL_.jpg",La vie d'Adèle,2013,A,180 min,"Drama, Romance",7.7,"Adèle's life is changed when she meets Emma, a young woman with blue hair, who will allow her to discover desire and to assert herself as a woman and as an adult. In front of others, Adèle grows, seeks herself, loses herself, and ultimately finds herself through love and loss.",89.0,Abdellatif Kechiche,Léa Seydoux,Adèle Exarchopoulos,Salim Kechiouche,Aurélien Recoing,138741,"2,199,675"
"https://m.media-amazon.com/images/M/MV5BMTgwNTAwMjEzMF5BMl5BanBnXkFtZTcwNzMzODY4OA@@._V1_UY98_CR3,0,67,98_AL_.jpg",Kai po che!,2013,U,130 min,"Drama, Sport",7.7,Three friends growing up in India at the turn of the millennium set out to open a training academy to produce the country's next cricket stars.,40.0,Abhishek Kapoor,Amit Sadh,Sushant Singh Rajput,Rajkummar Rao,Amrita Puri,32628,"1,122,527"
"https://m.media-amazon.com/images/M/MV5BMTQzMzg2Nzg2MF5BMl5BanBnXkFtZTgwNjUzNzIzMDE@._V1_UX67_CR0,0,67,98_AL_.jpg",The Broken Circle Breakdown,2012,,111 min,"Drama, Music, Romance",7.7,"Elise and Didier fall in love at first sight, in spite of their differences. He talks, she listens. He's a romantic atheist, she's a religious realist. When their daughter becomes seriously ill, their love is put on trial.",70.0,Felix van Groeningen,Veerle Baetens,Johan Heldenbergh,Nell Cattrysse,Geert Van Rampelberg,39379,"175,058"
"https://m.media-amazon.com/images/M/MV5BMzA2NDkwODAwM15BMl5BanBnXkFtZTgwODk5MTgzMTE@._V1_UY98_CR0,0,67,98_AL_.jpg",Captain America: The Winter Soldier,2014,UA,136 min,"Action, Adventure, Sci-Fi",7.7,"As Steve Rogers struggles to embrace his role in the modern world, he teams up with a fellow Avenger and S.H.I.E.L.D agent, Black Widow, to battle a new threat from history: an assassin known as the Winter Soldier.",70.0,Anthony Russo,Joe Russo,Chris Evans,Samuel L. Jackson,Scarlett Johansson,736182,"259,766,572"
"https://m.media-amazon.com/images/M/MV5BOTc3NzAxMjg4M15BMl5BanBnXkFtZTcwMDc2ODQwNw@@._V1_UY98_CR3,0,67,98_AL_.jpg",Rockstar,2011,UA,159 min,"Drama, Music, Musical",7.7,"Janardhan Jakhar chases his dreams of becoming a big Rock star, during which he falls in love with Heer.",,Imtiaz Ali,Ranbir Kapoor,Nargis Fakhri,Shammi Kapoor,Kumud Mishra,39501,"985,912"
"https://m.media-amazon.com/images/M/MV5BOGQzODdlMDktNzU4ZC00N2M3LWFkYTAtYTM1NTE0ZWI5YTg4XkEyXkFqcGdeQXVyMTA1NTM1NDI2._V1_UX67_CR0,0,67,98_AL_.jpg",Nebraska,2013,UA,115 min,"Adventure, Comedy, Drama",7.7,"An aging, booze-addled father makes the trip from Montana to Nebraska with his estranged son in order to claim a million-dollar Mega Sweepstakes Marketing prize.",87.0,Alexander Payne,Bruce Dern,Will Forte,June Squibb,Bob Odenkirk,112298,"17,654,912"
"https://m.media-amazon.com/images/M/MV5BNzMxNTExOTkyMF5BMl5BanBnXkFtZTcwMzEyNDc0OA@@._V1_UX67_CR0,0,67,98_AL_.jpg",Wreck-It Ralph,2012,U,101 min,"Animation, Adventure, Comedy",7.7,"A video game villain wants to be a hero and sets out to fulfill his dream, but his quest brings havoc to the whole arcade where he lives.",72.0,Rich Moore,John C. Reilly,Jack McBrayer,Jane Lynch,Sarah Silverman,380195,"189,422,889"
"https://m.media-amazon.com/images/M/MV5BNjg0OTM5OTQyNV5BMl5BanBnXkFtZTgwNDg5NDQ0NTE@._V1_UY98_CR2,0,67,98_AL_.jpg",Le Petit Prince,2015,PG,108 min,"Animation, Adventure, Drama",7.7,"A little girl lives in a very grown-up world with her mother, who tries to prepare her for it. Her neighbor, the Aviator, introduces the girl to an extraordinary world where anything is possible, the world of the Little Prince.",70.0,Mark Osborne,Jeff Bridges,Mackenzie Foy,Rachel McAdams,Marion Cotillard,56720,"1,339,152"
"https://m.media-amazon.com/images/M/MV5BMTM3NzQzMDA5Ml5BMl5BanBnXkFtZTcwODA5NTcyNw@@._V1_UY98_CR0,0,67,98_AL_.jpg",Detachment,2011,,98 min,Drama,7.7,A substitute teacher who drifts from classroom to classroom finds a connection to the students and teachers during his latest assignment.,52.0,Tony Kaye,Adrien Brody,Christina Hendricks,Marcia Gay Harden,Lucy Liu,77071,"71,177"
"https://m.media-amazon.com/images/M/MV5BMTM4NjY1MDQwMl5BMl5BanBnXkFtZTcwNTI3Njg3NA@@._V1_UX67_CR0,0,67,98_AL_.jpg",Midnight in Paris,2011,PG-13,96 min,"Comedy, Fantasy, Romance",7.7,"While on a trip to Paris with his fiancée's family, a nostalgic screenwriter finds himself mysteriously going back to the 1920s every day at midnight.",81.0,Woody Allen,Owen Wilson,Rachel McAdams,Kathy Bates,Kurt Fuller,388089,"56,816,662"
"https://m.media-amazon.com/images/M/MV5BMTg4MDk1ODExN15BMl5BanBnXkFtZTgwNzIyNjg3MDE@._V1_UX67_CR0,0,67,98_AL_.jpg",The Lego Movie,2014,U,100 min,"Animation, Action, Adventure",7.7,"An ordinary LEGO construction worker, thought to be the prophesied as ""special"", is recruited to join a quest to stop an evil tyrant from gluing the LEGO universe into eternal stasis.",83.0,Christopher Miller,Phil Lord,Chris Pratt,Will Ferrell,Elizabeth Banks,323982,"257,760,692"
"https://m.media-amazon.com/images/M/MV5BNjE5MzYwMzYxMF5BMl5BanBnXkFtZTcwOTk4MTk0OQ@@._V1_UX67_CR0,0,67,98_AL_.jpg",Gravity,2013,UA,91 min,"Drama, Sci-Fi, Thriller",7.7,Two astronauts work together to survive after an accident leaves them stranded in space.,96.0,Alfonso Cuarón,Sandra Bullock,George Clooney,Ed Harris,Orto Ignatiussen,769145,"274,092,705"
"https://m.media-amazon.com/images/M/MV5BMTk2NzczOTgxNF5BMl5BanBnXkFtZTcwODQ5ODczOQ@@._V1_UX67_CR0,0,67,98_AL_.jpg",Star Trek Into Darkness,2013,UA,132 min,"Action, Adventure, Sci-Fi",7.7,"After the crew of the Enterprise find an unstoppable force of terror from within their own organization, Captain Kirk leads a manhunt to a war-zone world to capture a one-man weapon of mass destruction.",72.0,J.J. Abrams,Chris Pine,Zachary Quinto,Zoe Saldana,Benedict Cumberbatch,463188,"228,778,661"
"https://m.media-amazon.com/images/M/MV5BMTYwMzMzMDI0NF5BMl5BanBnXkFtZTgwNDQ3NjI3NjE@._V1_UX67_CR0,0,67,98_AL_.jpg",Beasts of No Nation,2015,,137 min,"Drama, War",7.7,"A drama based on the experiences of Agu, a child soldier fighting in the civil war of an unnamed African country.",79.0,Cary Joji Fukunaga,Abraham Attah,Emmanuel Affadzi,Ricky Adelayitor,Andrew Adote,73964,"83,861"
"https://m.media-amazon.com/images/M/MV5BOGUyZDUxZjEtMmIzMC00MzlmLTg4MGItZWJmMzBhZjE0Mjc1XkEyXkFqcGdeQXVyMTMxODk2OTU@._V1_UX67_CR0,0,67,98_AL_.jpg",The Social Network,2010,UA,120 min,"Biography, Drama",7.7,"As Harvard student Mark Zuckerberg creates the social networking site that would become known as Facebook, he is sued by the twins who claimed he stole their idea, and by the co-founder who was later squeezed out of the business.",95.0,David Fincher,Jesse Eisenberg,Andrew Garfield,Justin Timberlake,Rooney Mara,624982,"96,962,694"
"https://m.media-amazon.com/images/M/MV5BMTg5OTMxNzk4Nl5BMl5BanBnXkFtZTcwOTk1MjAwNQ@@._V1_UX67_CR0,0,67,98_AL_.jpg",X: First Class,2011,UA,131 min,"Action, Adventure, Sci-Fi",7.7,"In the 1960s, superpowered humans Charles Xavier and Erik Lensherr work together to find others like them, but Erik's vengeful pursuit of an ambitious mutant who ruined his life causes a schism to divide them.",65.0,Matthew Vaughn,James McAvoy,Michael Fassbender,Jennifer Lawrence,Kevin Bacon,645512,"146,408,305"
"https://m.media-amazon.com/images/M/MV5BNGQwZjg5YmYtY2VkNC00NzliLTljYTctNzI5NmU3MjE2ODQzXkEyXkFqcGdeQXVyNzkwMjQ5NzM@._V1_UX67_CR0,0,67,98_AL_.jpg",The Hangover,2009,UA,100 min,Comedy,7.7,"Three buddies wake up from a bachelor party in Las Vegas, with no memory of the previous night and the bachelor missing. They make their way around the city in order to find their friend before his wedding.",73.0,Todd Phillips,Zach Galifianakis,Bradley Cooper,Justin Bartha,Ed Helms,717559,"277,322,503"
"https://m.media-amazon.com/images/M/MV5BMWZiNjE2OWItMTkwNy00ZWQzLWI0NTgtMWE0NjNiYTljN2Q1XkEyXkFqcGdeQXVyNzAwMjYxMzA@._V1_UX67_CR0,0,67,98_AL_.jpg",Skyfall,2012,UA,143 min,"Action, Adventure, Thriller",7.7,"James Bond's loyalty to M is tested when her past comes back to haunt her. When MI6 comes under attack, 007 must track down and destroy the threat, no matter how personal the cost.",81.0,Sam Mendes,Daniel Craig,Javier Bardem,Naomie Harris,Judi Dench,630614,"304,360,277"
"https://m.media-amazon.com/images/M/MV5BMTM2MTI5NzA3MF5BMl5BanBnXkFtZTcwODExNTc0OA@@._V1_UX67_CR0,0,67,98_AL_.jpg",Silver Linings Playbook,2012,A,122 min,"Comedy, Drama, Romance",7.7,"After a stint in a mental institution, former teacher Pat Solitano moves back in with his parents and tries to reconcile with his ex-wife. Things get more challenging when Pat meets Tiffany, a mysterious girl with problems of her own.",81.0,David O. Russell,Bradley Cooper,Jennifer Lawrence,Robert De Niro,Jacki Weaver,661871,"132,092,958"
"https://m.media-amazon.com/images/M/MV5BNzljNjY3MDYtYzc0Ni00YjU0LWIyNDUtNTE0ZDRiMGExMjZlXkEyXkFqcGdeQXVyMTMxODk2OTU@._V1_UX67_CR0,0,67,98_AL_.jpg",Argo,2012,A,120 min,"Biography, Drama, Thriller",7.7,"Acting under the cover of a Hollywood producer scouting a location for a science fiction film, a CIA agent launches a dangerous operation to rescue six Americans in Tehran during the U.S. hostage crisis in Iran in 1979.",86.0,Ben Affleck,Ben Affleck,Bryan Cranston,John Goodman,Alan Arkin,572581,"136,025,503"
"https://m.media-amazon.com/images/M/MV5BMTk5MjM4OTU1OV5BMl5BanBnXkFtZTcwODkzNDIzMw@@._V1_UX67_CR0,0,67,98_AL_.jpg",(500) Days of Summer,2009,UA,95 min,"Comedy, Drama, Romance",7.7,"An offbeat romantic comedy about a woman who doesn't believe true love exists, and the young man who falls for her.",76.0,Marc Webb,Zooey Deschanel,Joseph Gordon-Levitt,Geoffrey Arend,Chloë Grace Moretz,472242,"32,391,374"
"https://m.media-amazon.com/images/M/MV5BMTQ2OTE1Mjk0N15BMl5BanBnXkFtZTcwODE3MDAwNA@@._V1_UX67_CR0,0,67,98_AL_.jpg",Harry Potter and the Deathly Hallows: Part 1,2010,A,146 min,"Adventure, Family, Fantasy",7.7,"As Harry, Ron, and Hermione race against time and evil to destroy the Horcruxes, they uncover the existence of the three most powerful objects in the wizarding world: the Deathly Hallows.",65.0,David Yates,Daniel Radcliffe,Emma Watson,Rupert Grint,Bill Nighy,479120,"295,983,305"
"https://m.media-amazon.com/images/M/MV5BOTc3YmM3N2QtODZkMC00ZDE5LThjMTQtYTljN2Y1YTYwYWJkXkEyXkFqcGdeQXVyODEzNjM5OTQ@._V1_UX67_CR0,0,67,98_AL_.jpg",Gake no ue no Ponyo,2008,U,101 min,"Animation, Adventure, Comedy",7.7,"A five-year-old boy develops a relationship with Ponyo, a young goldfish princess who longs to become a human after falling in love with him.",86.0,Hayao Miyazaki,Cate Blanchett,Matt Damon,Liam Neeson,Tomoko Yamaguchi,125317,"15,090,400"
